{
  "category": "Media",
  "version": 1,
  "name": "Komga",
  "port": 25600,
  "description": "Komga is a media server for comics, manga, magazines, and ebooks.",
  "website": "https://komga.org",
  "dockerImage": "docker.io/gotson/komga:latest",
  "dockerPorts": [],
  "dockerNetworkMode": "bridge",
  "dockerVolumes": {
    "komga-config": "/config",
    "books": "/data"
  },
  "dockerEnvironment": {
    "TZ": "$TIMEZONE"
  }
}
